claim,fact-check agency,time,orginated,label,poynter_url
A man collapses in a staircase because of the CoV.,AFP,2020/01/29 ,Sri Lanka,Misleading,https://www.poynter.org/?ifcn_misinformation=a-man-collapses-in-a-staircase-because-of-the-cov
A positive case of the 2019 novel coronavirus was “confirmed” to be found in Cebu province.,VERA Files,2020/01/28 ,Philippines,Misleading,https://www.poynter.org/?ifcn_misinformation=a-positive-case-of-the-2019-novel-coronavirus-was-confirmed-to-be-found-in-cebu-province
Ukrainian media registered the first confirmed case of the new coronavirus.,VoxCheck,2020/01/27 ,Ukraine,False,https://www.poynter.org/?ifcn_misinformation=ukrainian-media-registered-the-first-confirmed-case-of-the-new-coronavirus
There are several new confirmed cases in several French cities.,AFP,2020/01/27 ,France,Misleading,https://www.poynter.org/?ifcn_misinformation=there-are-several-new-confirmed-cases-in-several-french-cities
The Health Authority confirmed 3 cases of the 2019 coronavirus in the country.,Ecuador Chequea,2020/01/27 ,Ecuador,False,https://www.poynter.org/?ifcn_misinformation=the-health-authority-confirmed-3-cases-of-the-2019-coronavirus-in-the-country
A new case of novel coronavirus was registered in Saudi Arabia. A nurse from India was diagnosed with the specific strain of the virus.,Ellinika Hoaxes,2020/01/24 ,Greece,False,https://www.poynter.org/?ifcn_misinformation=a-new-case-of-novel-coronavirus-was-registered-in-saudi-arabia-a-nurse-from-india-was-diagnosed-with-the-specific-strain-of-the-virus
"“Confirmed cases” of the novel coronavirus or 2019 nCoV were recorded at the Philippine Bank of Communications (PBCom) Tower in Makati City, according to a message that circulated Friday, Jan. 24.",Rappler,2020/01/24 ,Philippines,False,https://www.poynter.org/?ifcn_misinformation=confirmed-cases-of-the-novel-coronavirus-or-2019-ncov-were-recorded-at-the-philippine-bank-of-communications-pbcom-tower-in-makati-city-according-to-a-message-that-circulated-frid
The first case of new coronavirus in Venezuela has been registered. It comes from the Bolivar state.,Efecto Cocuyo,2020/01/23 ,Venezuela,False,https://www.poynter.org/?ifcn_misinformation=the-first-case-of-new-coronavirus-in-venezuela-has-been-registered-it-comes-from-the-bolivar-state
"A chain message circulated on Tuesday, Jan. 14, warning people to avoid going to Shangri-La Plaza (a mall in Mandaluyong City) because of a supposed case of Severe Acute Respiratory Syndrome (SARS) reported in one of the mall’s medical clinics.",Rappler,2020/01/14 ,Philippines,False,https://www.poynter.org/?ifcn_misinformation=a-chain-message-circulated-on-tuesday-jan-14-warning-people-to-avoid-going-to-shangri-la-plaza-a-mall-in-mandaluyong-city-because-of-a-supposed-case-of-severe-acute-respiratory-syndrome-sars-re
