,title,media,date,datetime,desc,link,img
171,Ryan Fitzpatrick had discussions with Washington teammates about COVID vaccine,NBC Sports,"Jul 29, 2021",2021-07-29,"... which will force teams to forfeit if they have a COVID-19 outbreak 
among ... The Washington Football Team, which has one of the lower 
vaccination rates...",https://www.nbcsports.com/washington/football-team/ryan-fitzpatrick-had-discussions-washington-teammates-about-covid-vaccine,"data:image/gif;base64,R0lGODlhAQABAIAAAP///////yH5BAEKAAEALAAAAAABAAEAAAICTAEAOw=="
172,Can This Houston-Born COVID Vaccine Save the Developing World?,Texas Monthly,"Jul 16, 2021",2021-07-16,"Peter Hotez and Maria Elena Bottazzi, co-directors of the Texas Children's 
Hospital Center for Vaccine Development, in Houston, have helped develop a 
COVID-19...",https://www.texasmonthly.com/news-politics/covid-vaccine-corbevax-india/,"data:image/gif;base64,R0lGODlhAQABAIAAAP///////yH5BAEKAAEALAAAAAABAAEAAAICTAEAOw=="
173,U.S. Covid vaccination rates rise as Americans in hard-hit states rush to get shots amid delta fears,CNBC,"Jul 30, 2021",2021-07-30,"U.S. Covid vaccination rates rise as Americans in hard-hit states rush to 
get shots amid delta fears · The pace of U.S. vaccinations is ticking 
upward as the...",https://www.cnbc.com/2021/07/30/us-covid-vaccine-rates-delta-variant.html,"data:image/gif;base64,R0lGODlhAQABAIAAAP///////yH5BAEKAAEALAAAAAABAAEAAAICTAEAOw=="
174,States are sitting on millions of surplus Covid-19 vaccine ...,Stat News,"Jul 20, 2021",2021-07-20,"Millions of unused Covid-19 vaccines are set to go to waste as demand 
dwindles across the United States and doses likely expire this summer, 
according to...",https://www.statnews.com/2021/07/20/states-are-sitting-on-millions-of-surplus-covid-19-vaccine-doses-as-expiration-dates-approach/,"data:image/gif;base64,R0lGODlhAQABAIAAAP///////yH5BAEKAAEALAAAAAABAAEAAAICTAEAOw=="
175,"Rarely, Covid vaccine breakthrough infections can be severe. Who's at risk?",NBC News,"Jul 19, 2021",2021-07-19,"Despite the power of Covid-19 vaccines in cutting the risk of 
hospitalization and death from the disease, fully vaccinated people can get 
very sick and die...",https://www.nbcnews.com/health/health-news/rarely-covid-vaccine-breakthrough-infections-can-be-severe-who-s-n1274164,"data:image/gif;base64,R0lGODlhAQABAIAAAP///////yH5BAEKAAEALAAAAAABAAEAAAICTAEAOw=="
176,BNT162b2 COVID-19 vaccine and correlates of humoral ...,The Lancet,"Jul 2, 2021",2021-07-02,"BNT162b2 COVID-19 vaccine and correlates of humoral immune responses and 
dynamics: a prospective, single-centre, longitudinal cohort study in 
health-care...",https://www.thelancet.com/journals/lanres/article/PIIS2213-2600(21)00220-4/fulltext,"data:image/gif;base64,R0lGODlhAQABAIAAAP///////yH5BAEKAAEALAAAAAABAAEAAAICTAEAOw=="
177,"After a Steep Plunge in Virus Cases, Every State Is Seeing an Uptick",The New York Times,"Jul 15, 2021",2021-07-15,"... who have not gotten shots to change their minds, urging them to 
consider that coronavirus vaccines are safe, free and available to anyone 
12 and older.",https://www.nytimes.com/2021/07/15/us/covid-cases-rise.html,"data:image/gif;base64,R0lGODlhAQABAIAAAP///////yH5BAEKAAEALAAAAAABAAEAAAICTAEAOw=="
178,"Federal law doesn't prohibit Covid-19 vaccine requirements, Justice Department says",CNN,"Jul 26, 2021",2021-07-26,"(CNN) Justice Department lawyers have determined that federal law doesn't 
prohibit public agencies and private businesses from requiring Covid-19 
vaccines...",https://www.cnn.com/2021/07/26/politics/doj-covid-19-vaccine-requirements-olc-opinion/index.html,"data:image/gif;base64,R0lGODlhAQABAIAAAP///////yH5BAEKAAEALAAAAAABAAEAAAICTAEAOw=="
179,"TechTank Podcast Episode 24: Managing Privacy, Equity, and Access in COVID Vaccine Passports",Brookings,"Jul 26, 2021",2021-07-26,"... Episode 24: Managing Privacy, Equity, and Access in COVID Vaccine 
Passports ... Digital health certificates, or vaccine passports, are part 
of these...",https://www.brookings.edu/blog/techtank/2021/07/26/techtank-podcast-episode-24-managing-privacy-equity-and-access-in-covid-vaccine-passports/,"data:image/gif;base64,R0lGODlhAQABAIAAAP///////yH5BAEKAAEALAAAAAABAAEAAAICTAEAOw=="
180,FDA Faces Challenges for Emergency Use Authorization of COVID Vaccine,National Law Review,"Jul 27, 2021",2021-07-27,"This was the procedure used for approval of the COVID-19 vaccines by the 
FDA of ... distribution to potential vaccine recipients of a fact sheet 
that states...",https://www.natlawreview.com/article/covid-19-vaccines-and-emergency-use-authorization-challenges,"data:image/gif;base64,R0lGODlhAQABAIAAAP///////yH5BAEKAAEALAAAAAABAAEAAAICTAEAOw=="
181,Are COVID Vaccines FDA Approved? Here's the Latest,NBC Chicago,"Jul 7, 2021",2021-07-07,"Currently, no coronavirus vaccine is fully approved by the FDA, but three 
were given emergency use authorization by the agency...",https://www.nbcchicago.com/news/coronavirus/are-covid-vaccines-fda-approved-heres-the-latest/2549097/,"data:image/gif;base64,R0lGODlhAQABAIAAAP///////yH5BAEKAAEALAAAAAABAAEAAAICTAEAOw=="
182,CT hospitals to require COVID vaccine for employees,CT Mirror,"Jul 5, 2021",2021-07-05,"Connecticut hospitals are requiring staff to get vaccinated against COVID. 
Will other health providers follow? by Jenna Carlesso...",https://ctmirror.org/2021/07/05/ct-hospitals-are-requiring-staff-to-get-vaccinated-against-covid/,"data:image/gif;base64,R0lGODlhAQABAIAAAP///////yH5BAEKAAEALAAAAAABAAEAAAICTAEAOw=="
183,"Living with Obesity? Get Your COVID Vaccine Now, Experts Say",WebMD,"Jul 21, 2021",2021-07-21,"All three FDA-approved COVID-19 vaccines are equally effective. ""The risk 
of being unvaccinated and potentially acquiring this disease is great in 
persons with...",https://www.webmd.com/vaccines/covid-19-vaccine/news/20210721/living-with-obesity-get-covid-vaccine-now-experts,"data:image/gif;base64,R0lGODlhAQABAIAAAP///////yH5BAEKAAEALAAAAAABAAEAAAICTAEAOw=="
184,A Few Grains Of Salt About That COVID Vaccine Decision ...,JD Supra,"Jul 2, 2021",2021-07-02,"We recently got our first federal court decision addressing whether an 
employer had the right to require employees to be vaccinated for COVID-19.",https://www.jdsupra.com/legalnews/a-few-grains-of-salt-about-that-covid-4198696/,"data:image/gif;base64,R0lGODlhAQABAIAAAP///////yH5BAEKAAEALAAAAAABAAEAAAICTAEAOw=="
185,Meet CNY’s most Covid vaccine-resistant town: What can a biker bar and ex-FBI profiler do?,Syracuse.com,"Jul 19, 2021",2021-07-19,"Meet CNY's most Covid vaccine-resistant town: What can a biker bar and 
ex-FBI profiler do? · Sam and Jackie Beagle run the Angler's Bait Shop in 
Willet, N.Y. · A...",https://www.syracuse.com/news/2021/07/meet-cnys-most-covid-vaccine-resistant-town-what-can-a-biker-bar-and-ex-fbi-profiler-do.html,"data:image/gif;base64,R0lGODlhAQABAIAAAP///////yH5BAEKAAEALAAAAAABAAEAAAICTAEAOw=="
186,De Blasio to expand COVID vaccine-or-test mandate to all city workers,New York Post,"Jul 26, 2021",2021-07-26,"Mayor Bill de Blasio will announce a two-phase rule that will see all city 
employees receive the vaccination or require weekly COVID-19 testing.",https://nypost.com/2021/07/26/nyc-expanding-covid-vaccine-or-test-mandate-to-all-city-workers/,"data:image/gif;base64,R0lGODlhAQABAIAAAP///////yH5BAEKAAEALAAAAAABAAEAAAICTAEAOw=="
187,Biden's Covid vaccine push crashes into reality,Politico,"Jul 7, 2021",2021-07-07,"Biden's Covid vaccine push crashes into reality. After falling short of its 
July 4th goal, the White House is now turning to a hyper-local strategy. 
But...",https://www.politico.com/news/2021/07/07/biden-covid-vaccine-push-498479,"data:image/gif;base64,R0lGODlhAQABAIAAAP///////yH5BAEKAAEALAAAAAABAAEAAAICTAEAOw=="
188,Opinion | U.S. Covid Vaccine Numbers Are Great. Keep Going.,The New York Times,"Jul 3, 2021",2021-07-03,"For all the missteps during its early days, the American coronavirus 
vaccination campaign is poised to go down as a triumph of science and 
public health.",https://www.nytimes.com/2021/07/03/opinion/covid-vaccine-us-hesitancy.html,"data:image/gif;base64,R0lGODlhAQABAIAAAP///////yH5BAEKAAEALAAAAAABAAEAAAICTAEAOw=="
189,Get Vaccinated | Safe and Healthy Buckeyes,Safe and Healthy Buckeyes,"Jul 23, 2021",2021-07-23,"The university encourages everyone who is eligible to get their COVID-19 
vaccination and booster. FAQs and additional information about the vaccine 
is...",https://safeandhealthy.osu.edu/get-vaccinated,"data:image/gif;base64,R0lGODlhAQABAIAAAP///////yH5BAEKAAEALAAAAAABAAEAAAICTAEAOw=="
190,How Dollar General Could Expand Covid Vaccine Access,Bloomberg.com,"Jul 7, 2021",2021-07-07,"Toni Young, co-founder of the Rural Health Service Providers Network, 
brought up an idea to expand the Covid-19 vaccination campaign: “You're 
going to think I'm...",https://www.bloomberg.com/graphics/2021-citylab-covid-vaccines-dollar-store-locations/,"data:image/gif;base64,R0lGODlhAQABAIAAAP///////yH5BAEKAAEALAAAAAABAAEAAAICTAEAOw=="
191,Crohn's disease and the COVID-19 vaccine: A guide,Medical News Today,"Jul 11, 2021",2021-07-11,"Crohn's disease is a form of inflammatory bowel disease (IBD). IBD occurs 
when a person's immune system does not function properly. The COVID-19 
vaccine is...",https://www.medicalnewstoday.com/articles/crohns-disease-covid-vaccine,"data:image/gif;base64,R0lGODlhAQABAIAAAP///////yH5BAEKAAEALAAAAAABAAEAAAICTAEAOw=="
192,UIC faculty and staff vaccination guidelines for fall,UIC Today,"Jul 21, 2021",2021-07-21,"Upon disclosing that you are fully vaccinated (at least 14 days since your 
final dose of a COVID-19 vaccine), you will not be required to participate 
in on-...",https://today.uic.edu/uic-faculty-and-staff-vaccination-guidelines-for-fall,"data:image/gif;base64,R0lGODlhAQABAIAAAP///////yH5BAEKAAEALAAAAAABAAEAAAICTAEAOw=="
193,"Haiti still awaiting first COVID vaccines, as cases surge",The New Humanitarian,"Jul 5, 2021",2021-07-05,"Vaccine rollout timing still unclear. UNICEF and the Ministry of Health had 
initially aimed to vaccinate 20 percent of the Haitian population by May, 
or roughly...",https://www.thenewhumanitarian.org/news/2021/7/5/haiti-still-awaiting-first-covid-vaccines-as-cases-surge,"data:image/gif;base64,R0lGODlhAQABAIAAAP///////yH5BAEKAAEALAAAAAABAAEAAAICTAEAOw=="
194,More health care providers issue COVID vaccine mandates. Why the trend will continue,KARE 11,"Jul 26, 2021",2021-07-26,"MINNEAPOLIS — As the Delta variant fuels a fast resurgence of COVID-19, the 
Minnesota Department of Health is making a pitch for residents to get 
vaccinated...",https://www.kare11.com/article/news/health/coronavirus/healthcare-providers-issue-covid-vaccine-mandates-trend-will-continue/89-a46d861b-5dd1-4c0c-ad41-80707c3dda92,"data:image/gif;base64,R0lGODlhAQABAIAAAP///////yH5BAEKAAEALAAAAAABAAEAAAICTAEAOw=="
195,Don't exempt religious objectors from COVID vaccine mandates,Los Angeles Times,"Jul 23, 2021",2021-07-23,"Policies requiring vaccination against COVID-19 need not include, and 
should not include, exceptions for those who have religious objections to 
vaccinations...",https://www.latimes.com/opinion/story/2021-07-23/religious-exemption-mandatory-vaccination-policies-constitution,"data:image/gif;base64,R0lGODlhAQABAIAAAP///////yH5BAEKAAEALAAAAAABAAEAAAICTAEAOw=="
196,Atlanta restaurant mandates COVID-19 vaccine for customers,Atlanta Journal-Constitution,"Jul 23, 2021",2021-07-23,"After a few positive covid cases last week we have decided that the health 
and safety of our staff and guests must be prioritized. Until you are 
vaccinated...",https://www.ajc.com/things-to-do/atlanta-restaurant-blog/atlanta-restaurant-mandates-covid-19-vaccine-for-customers/5TWMYJKJHNEBFHGLKKO22GXC6E/,"data:image/gif;base64,R0lGODlhAQABAIAAAP///////yH5BAEKAAEALAAAAAABAAEAAAICTAEAOw=="
197,In-Depth: 126K COVID vaccine doses went to waste in California since roll-out began,10News.com,"Jul 22, 2021",2021-07-22,"SAN DIEGO (KGTV) -- More than 126,000 COVID vaccine doses have gone to 
waste in California since the roll-out began, a number that healthcare 
experts hailed...",https://www.10news.com/news/in-depth/in-depth-126k-covid-vaccine-doses-went-to-waste-in-california-since-roll-out-began,"data:image/gif;base64,R0lGODlhAQABAIAAAP///////yH5BAEKAAEALAAAAAABAAEAAAICTAEAOw=="
198,Louisiana COVID vaccine lottery: See the rolling list of cash ...,The Advocate,"Jul 23, 2021",2021-07-23,"Louisiana is giving away $2.3 million in prizes to residents who are 
vaccinated against COVID-10. The first few drawings, which are held every 
Friday,...",https://www.theadvocate.com/baton_rouge/news/coronavirus/collection_da5fe96a-ebe3-11eb-ac15-97ddb4cb54b1.html,"data:image/gif;base64,R0lGODlhAQABAIAAAP///////yH5BAEKAAEALAAAAAABAAEAAAICTAEAOw=="
199,Vaccination Requirement FAQ,Springfield College,"Jul 24, 2021",2021-07-24,"The College has adopted the CDC recommendation of the COVID-19 booster shot 
two months following the J&J vaccine, five months from a Pfizer or 
Moderna...",https://springfield.edu/covid/vaccine-requirement,"data:image/gif;base64,R0lGODlhAQABAIAAAP///////yH5BAEKAAEALAAAAAABAAEAAAICTAEAOw=="
